Is Highlight,Object ID,Department,Object Name,Title,Artist Display Name,Year,Tags
FALSE,36493,Asian Art,Woodblock print,"冨嶽三十六景　駿州江尻|Ejiri in Suruga Province (Sunshū Ejiri), from the series Thirty-six Views of Mount Fuji (Fugaku sanjūrokkei)",Katsushika Hokusai,1842,Human Figures|Landscapes|Working
FALSE,36494,Asian Art,Woodblock print,"冨嶽三十六景　身延川裏不二|View from the Other Side of Fuji from the Minobu River (Minobugawa ura Fuji), from the series Thirty-six Views of Mount Fuji (Fugaku sanjūrokkei)",Katsushika Hokusai,1842,Men|Horses|Mountains|Landscapes|Trees
FALSE,36496,Asian Art,Woodblock print,"冨嶽三十六景　相州七里浜|Shichirigahama in Sagami Province (Sōshū Shichirigahama), from the series Thirty-six Views of Mount Fuji (Fugaku sanjūrokkei)",Katsushika Hokusai,1842,Mountains|Landscapes
FALSE,36497,Asian Art,Woodblock print,"冨嶽三十六景　武州玉川|Tama River in Musashi Province (Bushū Tamagawa), from the series Thirty-six Views of Mount Fuji (Fugaku sanjūrokkei)",Katsushika Hokusai,1842,Rivers|Mountains|Landscapes|Trees|Boats
FALSE,36498,Asian Art,Woodblock print,"冨嶽三十六景　相州箱根湖水|The Lake at Hakone in Sagami Province (Sōshū Hakone kosui), from the series Thirty-six Views of Mount Fuji (Fugaku sanjūrokkei)",Katsushika Hokusai,1842,Lakes|Mountains|Landscapes|Trees
FALSE,36503,Asian Art,Woodblock print,"冨嶽三十六景　相州江の島|Enoshima in Sagami Province (Sōshū Enoshima), from the series Thirty-six Views of Mount Fuji (Fugaku sanjūrokkei)",Katsushika Hokusai,1842,Houses|Mountains|Landscapes|Boats
FALSE,36509,Asian Art,Woodblock print,"冨嶽三十六景　青山円座松|Cushion Pine at Aoyama (Aoyama enza no matsu), from the series Thirty-six Views of Mount Fuji (Fugaku sanjūrokkei)",Katsushika Hokusai,1842,Mountains|Landscapes|Trees
FALSE,37320,Asian Art,Woodblock print,"冨嶽三十六景　駿州片倉茶園の不二|Fuji from the Katakura Tea Fields in Suruga (Sunshū Katakura chaen no Fuji), from the series Thirty-six Views of Mount Fuji (Fugaku sanjūrokkei)",Katsushika Hokusai,1842,Human Figures|Houses|Horses|Mountains|Landscapes
FALSE,44980,Asian Art,Print,Shinshu-sarashina tagoto no tsuki|本朝名所　信州更科田毎之月|Reflections of the Moon in the Rice Fields of Sarashina in Shinshu,Utagawa Hiroshige,1842,Moon|Hills|Landscapes|Trees
FALSE,49432,Asian Art,Album,清  潘思牧  山水  冊頁八開|Landscapes,Pan Simu,1842,Hills|Landscapes|Trees
FALSE,49934,Asian Art,Woodblock print,"琉球八景　泉崎夜月|Evening Moon at Izumizaki (Izaumizaki yagetsu), from the series Eight Views of the Ryūkyū Islands (Ryūkyū hakkei)",Katsushika Hokusai,1842,Houses|Bridges|Moon|Mountains|Landscapes
FALSE,49935,Asian Art,Woodblock print,"琉球八景　中島蕉園|Banana Garden at Nakashima (Nakashima shōen), from the series Eight Views of the Ryūkyū Islands (Ryūkyū hakkei)",Katsushika Hokusai,1842,Houses|Gardens|Landscapes|Trees
FALSE,49936,Asian Art,Woodblock print,"琉球八景　粂村竹籬|Bamboo Hedge at Kumemura (Kumemura chikuri), from the series Eight Views of the Ryūkyū Islands (Ryūkyū hakkei)",Katsushika Hokusai,1842,Houses|Landscapes|Boats
FALSE,49937,Asian Art,Woodblock print,"琉球八景　城嶽霊泉|The Sacred Spring at Jōgaku (Jōgaku reisen), from the series Eight Views of the Ryūkyū Islands (Ryūkyū hakkei)",Katsushika Hokusai,1842,Waterfalls|Mountains|Landscapes|Trees
FALSE,49938,Asian Art,Woodblock print,"琉球八景　臨海潮（湖）聲|Sound of the Lake at Rinkai (Rinkai kosei), from the series Eight Views of the Ryūkyū Islands (Ryūkyū hakkei)",Katsushika Hokusai,1842,Houses|Lakes|Landscapes|Boats
FALSE,49939,Asian Art,Woodblock print,"琉球八景　筍崖夕照|Evening Glow at Jungai (Jungai sekishō), from the series Eight Views of the Ryūkyū Islands (Ryūkyū hakkei)",Katsushika Hokusai,1842,Landscapes|Boats
FALSE,49941,Asian Art,Woodblock print,"琉球八景　龍洞松濤|Pines and Waves at Ryūtō (Ryūtō shōtō), from the series Eight Views of the Ryūkyū Islands (Ryūkyū hakkei)",Katsushika Hokusai,1842,Landscapes|Snow|Islands
FALSE,55226,Asian Art,Woodblock print,"冨嶽三十六景　下目黒|Lower Meguro (Shimo Meguro), from the series Thirty-six Views of Mount Fuji (Fugaku sanjūrokkei)",Katsushika Hokusai,1842,Human Figures|Landscapes|Trees
FALSE,55238,Asian Art,Woodblock print,"冨嶽三十六景　江都駿河町三井見世略図|Mitsui Shop at Surugachō in Edo (Edo Surugachō Mitsui mise ryaku zu), from the series Thirty-six Views of Mount Fuji (Fugaku sanjūrokkei)",Katsushika Hokusai,1842,Houses|Roofs|Men|Landscapes|Ladders
FALSE,55290,Asian Art,Woodblock print,"冨嶽三十六景　駿州片倉茶園の不二|Fuji from the Katakura Tea Fields in Suruga (Sunshū Katakura chaen no Fuji), from the series Thirty-six Views of Mount Fuji (Fugaku sanjūrokkei)",Katsushika Hokusai,1842,Animals|Houses|Men|Mountains|Landscapes
FALSE,55456,Asian Art,Woodblock print,"冨嶽三十六景　甲州犬目峠|The Inume Pass in Kai Province (Kōshū Inume tōge), from the series Thirty-six Views of Mount Fuji (Fugaku sanjūrokkei)",Katsushika Hokusai,1842,Horses|Mountains|Landscapes|Trees
FALSE,55466,Asian Art,Woodblock print,"琉球八景　城嶽霊泉|The Sacred Spring at Jōgaku (Jōgaku reisen), from the series Eight Views of the Ryūkyū Islands (Ryūkyū hakkei)",Katsushika Hokusai,1842,Landscapes
FALSE,55803,Asian Art,Print,「甲陽猿橋之図」|The Monkey Bridge in Kai Province (Kōyō Saruhashi no zu),Utagawa Hiroshige,1842,Streams|Bridges|Moon|Landscapes
FALSE,56131,Asian Art,Woodblock print,"冨嶽三十六景　隠田の水車|The Waterwheel at Onden (Onden no suisha), from the series Thirty-six Views of Mount Fuji (Fugaku sanjūrokkei)",Katsushika Hokusai,1842,Mountains|Landscapes|Working
FALSE,56213,Asian Art,Woodblock print,"冨嶽三十六景　駿州片倉茶園の不二|Fuji from the Katakura Tea Fields in Suruga (Sunshū Katakura chaen no Fuji), from the series Thirty-six Views of Mount Fuji (Fugaku sanjūrokkei)",Katsushika Hokusai,1842,Houses|Men|Women|Mountains|Landscapes
FALSE,56216,Asian Art,Woodblock print,"冨嶽三十六景　登戸浦|Noboto Bay (Noboto no ura), from the series Thirty-six Views of Mount Fuji (Fugaku sanjūrokkei)",Katsushika Hokusai,1842,Gates|Men|Landscapes
FALSE,56240,Asian Art,Woodblock print,"冨嶽三十六景　信州諏訪湖|Lake Suwa in Shinano Province (Shinshū Suwako), from the series Thirty-six Views of Mount Fuji (Fugaku sanjūrokkei)",Katsushika Hokusai,1842,Houses|Lakes|Landscapes|Trees|Boats
FALSE,56376,Asian Art,Woodblock print,"冨嶽三十六景　相州江の島|Enoshima in Sagami Province (Sōshū Enoshima), from the series Thirty-six Views of Mount Fuji (Fugaku sanjūrokkei)",Katsushika Hokusai,1842,Buildings|Landscapes|Mountains|Boats
FALSE,56385,Asian Art,Woodblock print,"冨嶽三十六景　相州箱根湖水|The Lake at Hakone in Sagami Province (Sōshū Hakone kosui), from the series Thirty-six Views of Mount Fuji (Fugaku sanjūrokkei)",Katsushika Hokusai,1842,Lakes|Mountains|Landscapes|Trees
FALSE,56389,Asian Art,Woodblock print,"冨嶽三十六景　下目黒|Lower Meguro (Shimo Meguro), from the series Thirty-six Views of Mount Fuji (Fugaku sanjūrokkei)",Katsushika Hokusai,1842,Men|Mountains|Landscapes|Trees
FALSE,56393,Asian Art,Woodblock print,"冨嶽三十六景　東海道品川御殿山の不二|Fuji from Gotenyama at Shinagawa on the Tōkaidō (Tōkaidō Shinagawa Gotenyama no Fuji), from the series Thirty-six Views of Mount Fuji (Fugaku sanjūrokkei)",Katsushika Hokusai,1842,Mountains|Landscapes|Trees
FALSE,56395,Asian Art,Woodblock print,"冨嶽三十六景　東都駿台|Surugadai in Edo (Tōto Sundai), from the series Thirty-six Views of Mount Fuji (Fugaku sanjūrokkei)",Katsushika Hokusai,1842,Houses|Men|Landscapes|Trees
FALSE,56892,Asian Art,Woodblock print,近江八景之内　三井晩鐘|Vesper Bells at Mii Temple,Utagawa Hiroshige,1842,Houses|Mountains|Landscapes|Trees
FALSE,56893,Asian Art,Print,近江八景之内　堅田落雁|Returning Geese at Katada,Utagawa Hiroshige,1842,Landscapes|Mountains|Boats
FALSE,56894,Asian Art,Print,近江八景之内　粟津晴嵐|Clearing Weather at Awazu,Utagawa Hiroshige,1842,Mountains|Landscapes|Boats
FALSE,56897,Asian Art,Print,近江八景之内　比良暮雪|Evening Snow on Mount Hira,Utagawa Hiroshige,1842,Houses|Mountains|Landscapes|Boats
FALSE,56899,Asian Art,Print,近江八景之内　唐崎夜雨|Evening Rain at Karasaki-Pine Tree,Utagawa Hiroshige,1842,Landscapes|Trees|Rain
FALSE,283071,Photographs,Photograph,"[Winter Trees, Reflected in a Pond]",William Henry Fox Talbot,1842,Ponds|Landscapes|Trees
FALSE,339732,Drawings and Prints,Drawing,Landscape,Théodore Rousseau,1842,Landscapes|Trees
FALSE,340327,Drawings and Prints,Drawing,Arcadian Landscape,"George Barret, the younger",1842,Human Figures|Cows|Bodies of Water|Landscapes|Trees
FALSE,364144,Drawings and Prints,Print,Salon of 1842:  Landscape with Animals,"Jules-Robert-Pierre-Joseph Challamel|Jacques-Raymond Brascassat|J. Rigo, Lebref et Cie",1842,Bulls|Goats|Landscapes
FALSE,373907,Drawings and Prints,Drawing,Harlech Castle across the Traeth Mawr,John Varley,1842,Castles|Hills|Landscapes|Clouds|Boats
FALSE,397993,Drawings and Prints,Drawing,A  Forest Edge with Peasants and a Village in the Background; verso: Landscape Sketch,Pieter Barbiers II,1842,Villages|Forests|Landscapes
FALSE,439375,European Paintings,Painting,View of Orange with Mont Ventoux,Paul Flandrin,1842,Mountains|Landscapes
FALSE,3315,American Decorative Arts,Dish,Dish,William Adams & Sons,1843,Landscapes|Men|Boats
FALSE,10494,American Decorative Arts,Drawing,"The Fountain, No. 1: The Wounded Indian Slaking His Death Thirst",Thomas Cole,1843,Men|Forests|Landscapes
FALSE,10506,American Decorative Arts,Watercolor,Farmington,Samuel Colman,1843,Landscapes|Trees
FALSE,21693,American Decorative Arts,Painting,Clouds,Thomas Cole,1843,Landscapes|Clouds
FALSE,37075,Asian Art,Print,諸国六玉河　武蔵　調布の玉川|Musashi: Chōfu no Tamagawa,Utagawa Hiroshige,1843,Men|Women|Landscapes|Working
FALSE,44981,Asian Art,Woodblock print,"雪月花　隅田|Snow on the Sumida River (Sumida), from the series, Snow, Moon, and Flowers (Setsugekka)",Katsushika Hokusai,1843,Rivers|Moon|Landscapes|Snow|Boats
FALSE,334356,Drawings and Prints,Drawing,View of Nemi,Camille Corot|Madame C. Bouchot,1843,Houses|Landscapes
FALSE,336839,Drawings and Prints,Print,Magpie,Charles-François Daubigny,1843,Birds|Landscapes|Trees
TRUE,337499,Drawings and Prints,Drawing,The Lake of Zug,Joseph Mallord William Turner,1843,Lakes|Mountains|Landscapes|Boats
FALSE,435985,European Paintings,Painting,"Study for ""The Destruction of Sodom""",Camille Corot,1843,Human Figures|Landscapes
FALSE,437079,European Paintings,Painting,Landscape with a Plowed Field and a Village,Georges Michel,1843,Landscapes
FALSE,439361,European Paintings,Painting,View of Genzano,Camille Corot,1843,Towns|Landscapes
FALSE,440329,European Paintings,Painting,Landscape,Jules Coignet,1843,Mountains|Landscapes
FALSE,36516,Asian Art,Print,京都名所之内  八瀬之里|Yase no Sato,Utagawa Hiroshige,1844,Men|Landscapes
FALSE,36926,Asian Art,Print,東海道五十三次之内　保土ヶ谷　新町橋|Hodogaya Station and Shinkame Bridge,Utagawa Hiroshige,1844,Human Figures|Bridges|Landscapes
FALSE,36927,Asian Art,Print,東海道五十三次之内　戸塚　元町別道|Totsuka; Moto Machi Betsudo,Utagawa Hiroshige,1844,Animals|Men|Women|Landscapes
FALSE,36936,Asian Art,Print,"東海道五十三次之内　吉原　左富士|Yoshiwara, Hidari Fuji",Utagawa Hiroshige,1844,Human Figures|Animals|Landscapes|Trees
FALSE,36939,Asian Art,Print,"東海道五十三次之内　奥津　興津川|Okitsu, Okitsugawa",Utagawa Hiroshige,1844,Men|Landscapes
FALSE,36942,Asian Art,Print,東海道五十三次之内　鞠子　名物茶店|Mariko; Meibutsu Chaya,Utagawa Hiroshige,1844,Men|Landscapes
FALSE,36946,Asian Art,Print,"東海道五十三次之内　金谷　大井川遠岸|Kanaya, Oigawa Em Gan",Utagawa Hiroshige,1844,Human Figures|Rivers|Hills|Landscapes
FALSE,36947,Asian Art,Print,"東海道五十三次之内　日坂　佐夜の中山|Nissaka, Sayo Nakayama",Utagawa Hiroshige,1844,Men|Mountains|Landscapes|Trees
FALSE,36954,Asian Art,Print,"東海道五十三次之内　白須賀　汐見阪図|Shirasuka, Shio-mi Zaka",Utagawa Hiroshige,1844,Landscapes
FALSE,36955,Asian Art,Print,"東海道五十三次之内　二川　猿ヶ馬場|Futagawa, Saru ga Baba",Utagawa Hiroshige,1844,Landscapes
FALSE,36956,Asian Art,Print,"東海道五十三次之内　吉田　豊川橋|Yoshida, Toyokawa Hashi",Utagawa Hiroshige,1844,Buildings|Bridges|Men|Rivers|Landscapes
FALSE,36959,Asian Art,Print,"東海道五十三次之内　藤川　棒鼻の図|Fujikawa, Bo Bana",Utagawa Hiroshige,1844,Horses|Men|Landscapes
FALSE,36970,Asian Art,Print,"東海道五十三次之内　阪之下　筆捨嶺|Saka-no-shita, Fude-sute Mine",Utagawa Hiroshige,1844,Men|Mountains|Landscapes
FALSE,37034,Asian Art,Print,東海道五十三次之内　袋井　出茶屋の図|Fukuroi; De Chaya,Utagawa Hiroshige,1844,Men|Landscapes|Trees
TRUE,267087,Photographs,Photograph,[Landscape with Cottage],Marie-Charles-Isidore Choiselat|Stanislas Ratel,1844,Houses|Ponds|Landscapes|Trees
FALSE,286201,Photographs,Photograph,"Loch Katrine Pier, Scene of the Lady of the Lake",William Henry Fox Talbot,1844,Lakes|Landscapes
FALSE,418574,Drawings and Prints,Drawing,Landscape,Henry William Burgess,1844,Rivers|Hills|Landscapes
FALSE,435986,European Paintings,Painting,View of Lormes,Camille Corot,1844,Villages|Landscapes
FALSE,438628,European Paintings,Painting,Pozzuoli and the Bay of Naples,Alexandre Calame,1844,Towns|Landscapes
FALSE,439376,European Paintings,Painting,View of Tivoli from Santa Maria del Giglio,Léon Fleury,1844,Roads|Landscapes
FALSE,441967,European Paintings,Painting,View over Hallingdal,Johan Christian Dahl,1844,Landscapes
FALSE,670947,Asian Art,Hanging scroll,,Nukina Kaioku,1844,Landscapes|Trees
FALSE,726471,Photographs,Photograph,[Egypt],Joseph-Philibert Girault de Prangey,1844,Bodies of Water|Landscapes
FALSE,9556,American Decorative Arts,Vase,Vase,,1845,Landscapes
FALSE,9557,American Decorative Arts,Vase,Vase,,1845,Landscapes
TRUE,10786,American Decorative Arts,Painting,The Beeches,Asher Brown Durand,1845,Sheep|Landscapes|Trees|Shepherds
FALSE,12548,American Decorative Arts,Drawing,"At Five Ponds, North Waterford, Maine",Edward Seager,1845,Mountains|Landscapes|Trees
FALSE,36017,Asian Art,Hanging scroll,清  湯貽汾  山水  軸|Landscape,Tang Yifen,1845,Mountains|Landscapes|Trees
FALSE,36512,Asian Art,Print,江戸近郊八景之内  羽根田落雁|Haneda Rakugan,Utagawa Hiroshige,1845,Landscapes
FALSE,36528,Asian Art,Print,"近江八景之内  瀬田夕照|Seta no Sekisho.  Sunset, Seta.  Lake Biwa",Utagawa Hiroshige,1845,Bridges|Lakes|Mountains|Landscapes|Boats
FALSE,36529,Asian Art,Print,"近江八景之内  粟津晴嵐|Clearing Weather at Awazu, Lake Biwa",Utagawa Hiroshige,1845,Lakes|Mountains|Landscapes|Boats
FALSE,37037,Asian Art,Print,木曽海道六拾九次之内　芦田|Ashida Station,Utagawa Hiroshige,1845,Human Figures|Hills|Landscapes|Trees
FALSE,37086,Asian Art,Print,近江八景之内　石山秋月|The Autumn Moon at Ishiyama on Lake Biwa.,Utagawa Hiroshige,1845,Landscapes
FALSE,49052,Asian Art,Hanging scroll,,Okamoto Toyohiko,1845,Houses|Landscapes|Trees
FALSE,55275,Asian Art,Print,木曽海道六拾九次之内　三渡野|Santono Station,Utagawa Hiroshige,1845,Human Figures|Landscapes|Trees
FALSE,55446,Asian Art,Print,木曽海道六拾九次之内　軽井沢|Karuizawa,Utagawa Hiroshige|Keisai Eisen,1845,Men|Horses|Fire|Landscapes|Trees
FALSE,57913,Asian Art,Illustrated book,小泉壇山画 『富岳写真』|Realistic Pictures of Mount Fuji (Fugaku shashin),Koizumi Daizan,1845,Mountains|Landscapes|Trees
FALSE,289183,Photographs,Photographically illustrated book,Lacock Abbey in Wiltshire,William Henry Fox Talbot,1845,Abbeys|Landscapes
FALSE,333776,Drawings and Prints,Drawing,Landscape,Alexandre-Gabriel Decamps,1845,Landscapes|Trees
FALSE,421658,Drawings and Prints,Drawing,"Waltham Abbey, Essex",Peter De Wint,1845,Abbeys|Landscapes
FALSE,437518,European Paintings,Painting,A River in a Meadow,Théodore Rousseau,1845,Cows|Rivers|Landscapes
FALSE,439766,European Paintings,Painting,"Mountain Landscape, Valais, Switzerland",Alexandre Calame,1845,Mountains|Landscapes
FALSE,459983,Robert Lehman Collection,Drawing,Landscape with a Stagecoach,British,1845,Roads|Landscapes|Carriages
FALSE,36511,Asian Art,Print,金沢八景  乙艫帰帆|Otomo Kihan,Utagawa Hiroshige,1846,Human Figures|Landscapes|Trees|Boats
FALSE,36525,Asian Art,Print,東都名所  佃島海辺朧月|Tsukudajima Kaihin Rōgetsu,Utagawa Hiroshige,1846,Landscapes|Boats
FALSE,56495,Asian Art,Print,Atagoshita Yabu-Kōji|東都名所　芝赤羽根之雪|Winter Landscape,Utagawa Hiroshige,1846,Human Figures|Bridges|Landscapes|Winter|Snow
FALSE,56890,Asian Art,Print,金沢八景　内川暮雪|Evening Snow at Uchikawa,Utagawa Hiroshige,1846,Landscapes|Trees|Snow
FALSE,56956,Asian Art,Print,木曽海道六拾九次之内　洗馬|Senba Station,Utagawa Hiroshige,1846,Men|Landscapes|Boats
FALSE,306202,Photographs,Photograph,"Garden of Selvia, Syracuse, Sicily",George Wilson Bridges,1846,Gardens|Men|Landscapes
FALSE,334091,Drawings and Prints,Book,The Paradise Lost of John Milton with Illustrations by John Martin,John Martin|John Milton|Charles Whittingham [the younger]|Septimus Prowett|Chatfield & Coleman,1846,Landscapes|Adam|Eve|Snakes
FALSE,439406,European Paintings,Painting,"The Bridge at La Cava, Kingdom of Naples",Joseph Bidauld,1846,Bridges|Landscapes
FALSE,696381,Drawings and Prints,Print,Little Oval with a Pine Tree,Eugène Stanislas Alexandre Bléry,1846,Bridges|Landscapes|Trees
FALSE,10583,American Decorative Arts,Drawing,Landscape with Tree and a Village in the Distance (from Cropsey Album),Jasper Francis Cropsey,1847,Villages|Landscapes|Trees
FALSE,78611,Asian Art,Illustrated books,,Utagawa Hiroshige,1847,Landscapes
FALSE,78710,Asian Art,Illustrated books,,Katsukawa Shunkō,1847,Landscapes
FALSE,268423,Photographs,Photograph,"Burnside, Fife / Island in the Almond River",David Octavius Hill|Robert  Adamson|Hill and Adamson,1847,Rivers|Landscapes
FALSE,268470,Photographs,Photograph,St. Andrews,David Octavius Hill|Robert  Adamson|Hill and Adamson,1847,Horses|Landscapes|Carriages
FALSE,368692,Drawings and Prints,Drawing,Rocky Cliff,Johann Christian Reinhart,1847,Landscapes
FALSE,382346,Drawings and Prints,Drawing,Landscape with a Young Girl at a Waterfall,Wolfgang Adam Töpffer,1847,Girls|Waterfalls|Landscapes|Trees
FALSE,395225,Drawings and Prints,Drawing,Southern landscape with a man and a snake,Heinrich Dreber,1847,Men|Snakes|Landscapes|Trees
FALSE,436859,European Paintings,Drawing,Catania and Mount Etna,Edward Lear,1847,Mountains|Landscapes
FALSE,440339,European Paintings,Painting,View in the Roman Campagna,Ernest-Joachim Dumax,1847,Fences|Landscapes
FALSE,659455,Drawings and Prints,Drawing,"Pentedatelo, Calabria, Italy",Edward Lear,1847,Buildings|Landscapes
FALSE,695528,European Paintings,Painting,View of Notre Dame de Versailles from the plaine de Rocquencourt towards the South,François Marius Granet,1847,Churches|Landscapes
FALSE,6162,American Decorative Arts,Plate,Plate,"Mellor, Venables & Co.",1848,Landscapes
FALSE,10495,American Decorative Arts,Drawing,Landscape with Tower (from McGuire Scrapbook),Thomas Cole,1848,Towers|Landscapes
FALSE,10498,American Decorative Arts,Drawing,Shipwreck,Thomas Cole,1848,Landscapes|Trees
FALSE,36550,Asian Art,Print,東海道五十三次  戸塚|Totsuka,Utagawa Hiroshige,1848,Hills|Landscapes|Trees
FALSE,36552,Asian Art,Print,東海道五十三次　平塚|Hiratsuka,Utagawa Hiroshige,1848,Human Figures|Houses|Mountains|Landscapes|Boats
FALSE,36553,Asian Art,Print,東海道五十三次　大磯|Ōiso,Utagawa Hiroshige,1848,Landscapes
FALSE,36558,Asian Art,Print,東海道五十三次　原|Hara,Utagawa Hiroshige,1848,Human Figures|Mountains|Landscapes|Trees
FALSE,36561,Asian Art,Print,東海道五十三次　江尻|Ejiri,Utagawa Hiroshige,1848,Human Figures|Houses|Mountains|Landscapes|Trees
FALSE,36566,Asian Art,Print,東海道五十三次　金谷|Kanaya,Utagawa Hiroshige,1848,Men|Hills|Landscapes
FALSE,36567,Asian Art,Print,東海道五十三次　袋井|Fukuroi,Utagawa Hiroshige,1848,Animals|Houses|Landscapes|Trees
FALSE,36571,Asian Art,Print,東海道五十三次　白須賀|Shirasuka,Utagawa Hiroshige,1848,Landscapes|Trees
FALSE,36583,Asian Art,Print,東海道五十三次　坂下|Saka-no-shita,Utagawa Hiroshige,1848,Men|Hills|Landscapes|Trees
FALSE,37005,Asian Art,Print,,Keisai Eisen,1848,Snow|Landscapes|Winter
FALSE,49434,Asian Art,Album,清   戴熙   山水圖  冊|Landscapes,Dai Xi,1848,Landscapes|Trees
FALSE,55154,Asian Art,Print,東海道五十三次　由井　由井川|Yui,Utagawa Hiroshige,1848,Bridges|Hills|Landscapes
FALSE,56903,Asian Art,Print,江戸近郊八景之内　玉川秋月|Autumn Moon on the Tama River,Utagawa Hiroshige,1848,Rivers|Moon|Landscapes|Autumn
FALSE,57065,Asian Art,Print,Azuma Mori Yau|江戸近郊八景之内　吾嬬杜夜雨|Evening Rain in Azuma Wood,Utagawa Hiroshige,1848,Landscapes|Trees|Rain
FALSE,78800,Asian Art,Illustrated books,,Katsushika Hokusai,1848,Books|Landscapes|Ships
FALSE,336855,Drawings and Prints,Print,Autumn,Charles-François Daubigny|A. Beillet,1848,Donkeys|Landscapes|Autumn
FALSE,376789,Drawings and Prints,Drawing,Landscape in Saxony,Carl August Richter,1848,Landscapes|Trees
FALSE,428622,Drawings and Prints,Drawing,A View of Cavi in the Sabine Hills,Louis Gurlitt,1848,Buildings|Hills|Landscapes|Trees
FALSE,439360,European Paintings,Painting,View of Genzano with a Rider and Peasant,Camille Corot,1848,Human Figures|Buildings|Towns|Horse Riding|Landscapes
FALSE,3318,American Decorative Arts,Dish,Dish,Enoch Wood & Sons,1849,Landscapes|Boats
FALSE,6181,American Decorative Arts,Plate,Plate,"William Ridgway, Son & Co.",1849,Landscapes
FALSE,6224,American Decorative Arts,Plate,Plate,Enoch Wood & Sons,1849,Landscapes
FALSE,6225,American Decorative Arts,Plate,Plate,Enoch Wood & Sons,1849,Landscapes
FALSE,6227,American Decorative Arts,Plate,Plate,Enoch Wood & Sons,1849,Landscapes|Shells|Trains
FALSE,6229,American Decorative Arts,Plate,Plate,Enoch Wood & Sons,1849,Flowers|Landscapes
FALSE,6231,American Decorative Arts,Plate,Plate,Enoch Wood & Sons,1849,Animals|Landscapes|Boats
FALSE,6531,American Decorative Arts,Platter,Platter,"William Ridgway, Son & Co.",1849,Landscapes
FALSE,11197,American Decorative Arts,Watercolor,Mr. Mason by the Sea,Daniel Huntington,1849,Men|Seas|Landscapes
FALSE,16986,American Decorative Arts,Drawing,Landscape (from Cropsey Album),Jasper Francis Cropsey,1849,Landscapes
FALSE,37220,Asian Art,Print,東海道五十三次　日阪　夜啼石　無間山　小夜の中山|Nissaka,Utagawa Hiroshige,1849,Men|Women|Hills|Landscapes|Trees
FALSE,37242,Asian Art,Print,東海道五十三次　関|Seki,Utagawa Hiroshige,1849,Gates|Landscapes|Trees|Snow
FALSE,46336,Asian Art,Cup,,,1849,Men|Landscapes|Trees|Cups
FALSE,46391,Asian Art,Saucer,,,1849,Roosters|Landscapes|Saucers
FALSE,46676,Asian Art,Vase,,,1849,Human Figures|Houses|Landscapes|Vases
FALSE,46869,Asian Art,Vase,,,1849,Houses|Landscapes|Trees|Vases
FALSE,51174,Asian Art,Saucer,,,1849,Men|Lambs|Landscapes|Saucers
FALSE,54227,Asian Art,Print,,Katsushika Hokusai,1849,Men|Women|Landscapes|Trees
FALSE,54428,Asian Art,Print,,Katsushika Hokusai,1849,Mountains|Landscapes|Winter
FALSE,54429,Asian Art,Print,,Katsushika Hokusai,1849,Landscapes|Boats
FALSE,54431,Asian Art,Print,,Katsushika Hokusai,1849,Landscapes|Bridges
FALSE,54432,Asian Art,Print,,Katsushika Hokusai,1849,Women|Landscapes
FALSE,54437,Asian Art,Print,,Katsushika Hokusai,1849,Houses|Bridges|Landscapes|Boats
FALSE,56147,Asian Art,Woodblock print,"百人一首　宇波か縁説　参儀等|Poem by Sangi Hitoshi (Minamoto no Hitoshi), from the series One Hundred Poems Explained by the Nurse (Hyakunin isshu uba ga etoki)",Katsushika Hokusai,1849,Men|Landscapes
FALSE,56148,Asian Art,Woodblock print,"百人一首　乳母かゑとき　柿の本人麿|Poem by Kakinomoto Hitomaro, from the series One Hundred Poems Explained by the Nurse (Hyakunin isshu uba ga etoki)",Katsushika Hokusai,1849,Human Figures|Mountains|Landscapes
FALSE,56175,Asian Art,Woodblock print,"百人一首　宇波かゑとき　安部仲麿|Poem by Abe no Nakamaro, from the series One Hundred Poems Explained by the Nurse (Hyakunin isshu uba ga etoki)",Katsushika Hokusai,1849,Human Figures|Moon|Landscapes|Boats
FALSE,56202,Asian Art,Woodblock print,"諸國名橋奇覧　摂洲阿治川口天保山|Tenpōzan at the Mouth of the Aji River in Settsu Province (Sesshū Ajikawaguchi Tenpōzan), from the series Remarkable Views of Bridges in Various Provinces (Shokoku meikyō kiran)",Katsushika Hokusai,1849,Landscapes|Bridges|Mountains|Boats
FALSE,56797,Asian Art,Print,,Katsushika Hokusai,1849,Portraits|Women|Landscapes
FALSE,58564,Asian Art,Inrō,楼閣山水蒔絵印籠　銘寛哉|Inrō with Chinese Landscape in Moonlight,,1849,Moon|Landscapes|Trees
FALSE,341431,Drawings and Prints,Drawing,"Landscape with a Rock Wall, perhaps in Westmorland",Peter De Wint,1849,Landscapes
FALSE,436940,European Paintings,Painting,David at the Cave of Adullam,Giovanni Maldura,1849,Soldiers|Men|Caves|Landscapes|David
FALSE,439769,European Paintings,Painting,Path in the Roman Campagna,Giovanni Battista Camuccini,1849,Roads|Landscapes
