Is Highlight,Object ID,Department,Object Name,Title,Artist Display Name,Year,Tags
FALSE,15838,American Decorative Arts,Drawing,Two Sketches of Mountain Landscapes (from Sketchbook),Albert Bierstadt,1890,Mountains|Landscapes|Trees
FALSE,15841,American Decorative Arts,Drawing,Landscape with Trees and Figure in a Canoe (from Sketchbook),Albert Bierstadt,1890,Landscapes|Trees
FALSE,15842,American Decorative Arts,Drawing,Two Landscape Sketches with Trees and Mountains (from Sketchbook),Albert Bierstadt,1890,Mountains|Landscapes|Trees
FALSE,15843,American Decorative Arts,Drawing,Rocky Landscape with Trees (from Sketchbook),Albert Bierstadt,1890,Landscapes|Trees
FALSE,15850,American Decorative Arts,Drawing,Sketch of a Cliffside with Trees (from Sketchbook),Albert Bierstadt,1890,Landscapes|Trees
FALSE,15851,American Decorative Arts,Drawing,"Kalama, Columbia River, Washington (from Sketchbook)",Albert Bierstadt,1890,Rivers|Landscapes|Trees
FALSE,15858,American Decorative Arts,Drawing,Small Section of a Landscape (from Sketchbook),Albert Bierstadt,1890,Landscapes
FALSE,291679,Photographs,Photograph,Sookh-Vilas Palace Garden,Lala Deen Dayal,1890,Gardens|Landscapes
FALSE,339677,Drawings and Prints,Drawing,"Studies of Landscape, Trees, and Exotic Fruit",Auguste Renoir,1890,Fruit|Landscapes|Trees
FALSE,341674,Drawings and Prints,Drawing,Spring,John William North,1890,Human Figures|Landscapes|Trees|Spring
FALSE,357860,Drawings and Prints,Drawing,"Design for a Stage Set at the Opéra, Paris",Eugène Cicéri,1890,Bodies of Water|Mountains|Landscapes
FALSE,357862,Drawings and Prints,Drawing,"Design for a Stage Set at the Opéra, Paris",Eugène Cicéri,1890,Landscapes|Trees
FALSE,357864,Drawings and Prints,Drawing,"Design for a Stage Set at the Opéra, Paris (recto); Design for a doorway (verso)",Eugène Cicéri,1890,Bodies of Water|Hills|Landscapes|Trees
FALSE,357867,Drawings and Prints,Drawing,"Design for a Stage Set at the Opéra, Paris",Eugène Cicéri,1890,Bodies of Water|Landscapes
FALSE,357874,Drawings and Prints,Drawing,"Design for a Stage Set at the Opéra, Paris (recto); Man with Cane (verso)",Eugène Cicéri,1890,Tools and Equipment|Buildings|Men|Mountains|Landscapes
FALSE,357875,Drawings and Prints,Drawing,"Design for a Stage Set at the Opéra, Paris",Eugène Cicéri,1890,Landscapes|Trees
FALSE,357876,Drawings and Prints,Drawing,"Design for a Stage Set at the Opéra, Paris",Eugène Cicéri,1890,Mountains|Landscapes
FALSE,357883,Drawings and Prints,Drawing,"Design for a Stage Set at the Opéra, Paris",Eugène Cicéri,1890,Mountains|Landscapes|Trees
FALSE,357985,Drawings and Prints,Drawing,"Design for a Stage Set at the Opéra, Paris",Eugène Cicéri,1890,Houses|Mountains|Landscapes|Trees
FALSE,358679,Drawings and Prints,Drawing,"Design for a Stage Set at the Opéra, Paris",Eugène Cicéri,1890,Mountains|Landscapes|Trees
FALSE,358707,Drawings and Prints,Drawing,"Design for a Stage Set at the Opéra, Paris",Eugène Cicéri,1890,Tents|Hills|Landscapes
FALSE,359045,Drawings and Prints,Drawing,"Design for a Stage Set at the Opéra, Paris",Eugène Cicéri,1890,Mountains|Landscapes|Trees
FALSE,359047,Drawings and Prints,Drawing,"Design for a Stage Set at the Opéra, Paris",Eugène Cicéri,1890,Bodies of Water|Hills|Landscapes
FALSE,387305,Drawings and Prints,Drawing,Design for a Stage Set,Eugène Cicéri,1890,Landscapes|Trees
FALSE,387323,Drawings and Prints,Drawing,Design for a Stage Set,Eugène Cicéri,1890,Landscapes
FALSE,387334,Drawings and Prints,Drawing,Design for a Stage Set,Eugène Cicéri,1890,Villages|Landscapes
FALSE,387346,Drawings and Prints,Drawing,Design for a Stage Set: Backdrop of Tropical Landscape,Eugène Cicéri,1890,Landscapes|Trees
FALSE,387350,Drawings and Prints,Drawing,Design for a Stage Set,Eugène Cicéri,1890,Theatre|Landscapes
FALSE,387358,Drawings and Prints,Drawing,Design for a Stage Set,Eugène Cicéri,1890,Bodies of Water|Landscapes|Boats
FALSE,387986,Drawings and Prints,Print,Landscape after Corot,Camille Corot|Ferdinand Lefman,1890,Men|Landscapes|Trees
FALSE,407332,Drawings and Prints,Print,"Costa Rica, from Flags of All Nations, Series 2 (N10) for Allen & Ginter Cigarettes Brands",Allen & Ginter,1890,Landscapes|Flags
FALSE,407387,Drawings and Prints,Print,"Orange Free State, from Flags of All Nations, Series 2 (N10) for Allen & Ginter Cigarettes Brands",Allen & Ginter,1890,Landscapes|Flags
FALSE,407409,Drawings and Prints,Print,"Salvador, from Flags of All Nations, Series 2 (N10) for Allen & Ginter Cigarettes Brands",Allen & Ginter,1890,Volcanoes|Landscapes|Flags
FALSE,419919,Drawings and Prints,Print,"Antelope, from Quadrupeds series (N41) for Allen & Ginter Cigarettes","Allen & Ginter|Lindner, Eddy & Claus",1890,Turtles|Landscapes
FALSE,421712,Drawings and Prints,Print,"Black-necked Stilt, from the Game Birds series (N40) for Allen & Ginter Cigarettes",Allen & Ginter,1890,Birds|Landscapes
FALSE,421720,Drawings and Prints,Print,"Canada Grouse, from the Game Birds series (N40) for Allen & Ginter Cigarettes",Allen & Ginter,1890,Birds|Landscapes
FALSE,421781,Drawings and Prints,Print,"Sandpiper, from the Game Birds series (N40) for Allen & Ginter Cigarettes",Allen & Ginter,1890,Human Figures|Birds|Landscapes
FALSE,421880,Drawings and Prints,Print,"Opossum, from Quadrupeds series (N41) for Allen & Ginter Cigarettes","Allen & Ginter|Lindner, Eddy & Claus",1890,Animals|Landscapes
FALSE,436971,European Paintings,Painting,The Flood Gate,Emile van Marcke,1890,Cows|Landscapes
FALSE,437998,European Paintings,Painting,Olive Trees,Vincent van Gogh,1890,Landscapes|Olive Trees
FALSE,459111,Robert Lehman Collection,Painting,Sea and Cliffs,Auguste Renoir,1890,Landscapes|Boats
FALSE,669904,Photographs,Photograph,"No. 6. From South Approach of Franklin Ave Bridge, Minneapolis, Minnesota Looking Up Stream (Low Water)",Henry P. Bosse,1890,Bodies of Water|Landscapes
FALSE,683006,Drawings and Prints,Print,"Scene 4, from Jack and the Giant Killer, Scenes for a Toy Theater",Benjamin Pollock,1890,Bodies of Water|Sun|Hills|Landscapes
FALSE,751589,Drawings and Prints,Print,Landscape,Frank Anderson,1890,Landscapes
TRUE,11234,American Decorative Arts,Painting,"Spring Blossoms, Montclair, New Jersey",George Inness,1891,Landscapes|Trees|Spring
FALSE,11377,American Decorative Arts,Watercolor,"The Island of Moorea Looking across the Strait from Tahiti, January 1891",John La Farge,1891,Landscapes
FALSE,11390,American Decorative Arts,Watercolor,"Double Study of Dawn, Moorea Seen across the Water, Tahiti",John La Farge,1891,Landscapes
FALSE,12061,American Decorative Arts,Painting,"Cliffs at Deir el Bahri, Egypt",John Singer Sargent,1891,Landscapes
FALSE,12122,American Decorative Arts,Painting,Landscape with Goatherd,John Singer Sargent,1891,Human Figures|Goats|Landscapes|Trees
FALSE,12218,American Decorative Arts,Drawing,"Greek Theatre, Epidaurus",John Singer Sargent,1891,Mountains|Landscapes
FALSE,57327,Asian Art,Hanging scroll,,Shibata Zeshin,1891,Landscapes|Trees|Boats
FALSE,75156,Asian Art,Fan mounted as an album leaf,,Shibata Zeshin,1891,Landscapes
FALSE,335621,Drawings and Prints,Drawing,Landscape,Johan Barthold Jongkind,1891,Landscapes|Trees
FALSE,359573,Drawings and Prints,Drawing,Farmhouses,Johannes Bosboom,1891,Houses|Landscapes|Trees
FALSE,364095,Drawings and Prints,Drawing,Landscape with a Path between Trees,Auguste Renoir,1891,Landscapes|Trees
FALSE,437269,European Paintings,Painting,"January: Cernay, near Rambouillet",Léon-Germain Pelouse,1891,Landscapes|Winter|Snow
TRUE,438821,European Paintings,Painting,Ia Orana Maria (Hail Mary),Paul Gauguin,1891,Jesus|Women|Landscapes|Angels|Virgin Mary
FALSE,669916,Photographs,Photograph,"No. 186. Chicago, Burlington & Northern Rail Road Bridge Across Mouth of La Croix River",Henry P. Bosse,1891,Bridges|Bodies of Water|Landscapes
FALSE,680016,Photographs,Boudoir Card; Cabinet Card,"[Self-Portrait at Glacier Bay, Alaska]",Frank Jay Haynes,1891,Men|Self-portraits|Landscapes
FALSE,751593,Drawings and Prints,Print,Landscape,Frank Anderson,1891,Landscapes|Trees
FALSE,771493,Drawings and Prints,Print,Trout Pond,Franz von Stuck,1891,Ponds|Landscapes|Trees
FALSE,11278,American Decorative Arts,Painting,Autumn,H. Bolton Jones,1892,Landscapes|Autumn
FALSE,11517,American Decorative Arts,Painting,Old Manor of Criqueboeuf,Homer Dodge Martin,1892,Landscapes|Houses
FALSE,13354,American Decorative Arts,Watercolor,Mountain Landscape,Alexander H. Wyant,1892,Mountains|Landscapes
FALSE,13453,American Decorative Arts,Painting,Off Greenland—Whaler Seeking Open Water,William Bradford,1892,Landscapes|Ships
FALSE,358802,Drawings and Prints,Print,Horses in the Meadow,Edgar Degas,1892,Horses|Landscapes
FALSE,359362,Drawings and Prints,Print,Landscape,Edgar Degas,1892,Mountains|Landscapes
FALSE,389144,Drawings and Prints,Drawing,"Standing on the Base Ground...I Become a Transparent Eyeball (Illustration for Ralph Waldo Emerson's ""Nature"")",Christopher Pearse Cranch,1892,Landscapes
FALSE,435750,European Paintings,Painting,Beaulieu: The Bay of Fourmis,Eugène Boudin,1892,Seas|Landscapes
FALSE,436451,European Paintings,Painting,Tahitian Landscape,Paul Gauguin,1892,Men|Women|Horses|Landscapes
FALSE,710909,Drawings and Prints,Print,"Governor McGill, Minnesota, from ""Governors, Arms, Etc."" series (N133-1), issued by Duke Sons & Co.","W. Duke, Sons & Co.",1892,Men|Portraits|Landscapes|Coat of Arms|Flags
FALSE,710933,Drawings and Prints,Print,"Governor Semple, Washington Territory, from ""Governors, Arms, Etc."" series (N133-1), issued by Duke Sons & Co.","W. Duke, Sons & Co.",1892,Men|Portraits|Landscapes|Coat of Arms|Flags
FALSE,710938,Drawings and Prints,Print,"Governor Beaver, Pennsylvania, from ""Governors, Arms, Etc."" series (N133-1), issued by Duke Sons & Co.","W. Duke, Sons & Co.",1892,Musical Instruments|Men|Portraits|Landscapes|Coat of Arms
FALSE,710960,Drawings and Prints,Print,"Governor Hughes, Arkansas, from ""Governors, Arms, Etc."" series (N133-2), issued by Duke Sons & Co.","W. Duke, Sons & Co.",1892,Men|Portraits|Landscapes|Coat of Arms|Flags
FALSE,710982,Drawings and Prints,Print,"Governor Ormsbee, Vermont, from ""Governors, Arms, Etc."" series (N133-2), issued by Duke Sons & Co.","W. Duke, Sons & Co.",1892,Men|Profiles|Landscapes|Coat of Arms|Flags
FALSE,12763,American Decorative Arts,Watercolor,Deer in a Landscape,Karl Bodmer,1893,Deer|Landscapes
FALSE,14299,American Decorative Arts,Drawing,Study of Rocks,John William Casilear,1893,Landscapes
FALSE,16556,American Decorative Arts,Drawing,"Landscape, River and Town (from Sketchbook)",John William Casilear,1893,Landscapes
FALSE,20421,American Decorative Arts,Painting,"Evening at the Lock, Napanoch, New York",Theodore Robinson,1893,Landscapes|Evening
FALSE,75882,Asian Art,Illustrated book,,,1893,Books|Mountains|Landscapes|Trees
FALSE,349106,Drawings and Prints,Drawing,Drawing for an Etching: Cavaliers in a Landscape,Evert Louis van Muyden,1893,Human Figures|Horse Riding|Landscapes|Trees
FALSE,383996,Drawings and Prints,Print,The Rainbow,Félix Bracquemond,1893,Female Nudes|Bodies of Water|Landscapes|Plants|Rainbows
FALSE,633446,Drawings and Prints,Print,Landscape (Paysage),Charles-Marie Dulac|André Marty,1893,Landscapes|Trees
FALSE,633447,Drawings and Prints,Print,The Deluge (L'Inondation) (Landscape with Poplars),Charles Guilloux|André Marty,1893,Landscapes|Trees
FALSE,662147,Drawings and Prints,Print,Landscape (Paysage),André Marty|Paul Sérusier,1893,Landscapes|Trees
FALSE,11017,American Decorative Arts,Watercolor,Mill Dam in Traunstein,William Stanley Haseltine,1894,Landscapes|Trees
FALSE,12629,American Decorative Arts,Watercolor,Frontier Cabin,William Louis Sonntag,1894,Bridges|Landscapes|Trees
FALSE,12831,American Decorative Arts,Painting,Dawn—Early Spring,Dwight William Tryon,1894,Landscapes|Dawn
FALSE,36181,Asian Art,Folding fan mounted as an album leaf,清  吳榖祥  山水  扇面|Landscape,Wu Guxiang,1894,Landscapes|Boats
FALSE,36198,Asian Art,Hanging scroll,近代  陸恢  山水  軸|Landscape,Lu Hui,1894,Landscapes|Plants
FALSE,358748,Drawings and Prints,Print,Landscape at Osny (Paysage à Osny),Camille Pissarro|André Marty,1894,Houses|Landscapes|Trees
FALSE,435874,European Paintings,Painting,The House with the Cracked Walls,Paul Cézanne,1894,Houses|Landscapes
FALSE,437347,European Paintings,Painting,Ludus pro patria (Patriotic Games),Pierre Puvis de Chavannes,1894,Men|Female Nudes|Sports|Landscapes|Athletes
FALSE,437683,European Paintings,Painting,Sahurs Meadows in Morning Sun,Alfred Sisley,1894,Landscapes|Morning
FALSE,633559,Drawings and Prints,Print,Landscape (Paysage),Armand Séguin|André Marty,1894,Women|Landscapes
FALSE,10181,American Decorative Arts,Painting,Landscape,Ralph Albert Blakelock,1895,Landscapes|Trees
FALSE,10215,American Decorative Arts,Painting,Marine Landscape,Alfred Thompson Bricher,1895,Seas|Hills|Landscapes|Boats
FALSE,10690,American Decorative Arts,Drawing,The Red Barn,Arthur B. Davies,1895,Barns|Landscapes
FALSE,11399,American Decorative Arts,Drawing,Landscape (from McGuire Scrapbook),Charles Lanman,1895,Landscapes|Trees
FALSE,11518,American Decorative Arts,Painting,View on the Seine: Harp of the Winds,Homer Dodge Martin,1895,Landscapes|Trees
FALSE,15534,American Decorative Arts,Drawing,Landscape with Mountains (from Sketchbook X),William Trost Richards,1895,Mountains|Landscapes
FALSE,19352,American Decorative Arts,Watercolor,Landscape—Catskills,Louis Michel Eilshemius,1895,Landscapes|Trees
FALSE,339460,Drawings and Prints,Print; Poster,Modern Art,Joseph Moore Bowles|Arthur Wesley Dow|Louis Prang & Co.,1895,Bodies of Water|Flowers|Landscapes
FALSE,339474,Drawings and Prints,Print,The Lark: November,Florence Lundborg,1895,Hills|Landscapes
FALSE,363438,Drawings and Prints,Print,Major General Charles Lee,Alexander Hay Ritchie|B. Rushbrooke|General Charles Lee,1895,Hats|Jackets|Army|Swords|Landscapes|Dogs|Generals
FALSE,437307,European Paintings,Painting,"Poplars, Éragny",Camille Pissarro,1895,Gardens|Landscapes
FALSE,459122,Robert Lehman Collection,Painting,A Pond near Nangis,Paul-Désiré Trouillebert,1895,Landscapes|Boats
FALSE,638483,Drawings and Prints,Print,"Sentier du Tambourin, Ile de Noirmoutier",Tancrède Abraham,1895,Landscapes|Trees
FALSE,11382,American Decorative Arts,Watercolor,"Sheep Porcupine Island, Bar Harbor, Maine, Evening Study, August 29, 1896",John La Farge,1896,Landscapes
FALSE,20030,American Decorative Arts,Tile,Tile,Charles Volkmar,1896,Landscapes
FALSE,267829,Photographs,Photograph,Motiv aus Pommern,Hugo Henneberg,1896,Houses|Landscapes|Trees|Clouds
FALSE,339256,Drawings and Prints,Print; Poster,Meadow Grass,Louis John Rhead|G. H. Walker & Co. Lithography|Copeland and Day,1896,Landscapes|Trees
FALSE,459095,Robert Lehman Collection,Painting,Pines Along the Shore,Henri-Edmond Cross (Henri-Edmond Delacroix),1896,Landscapes|Trees
FALSE,675527,Photographs,Album; Artist's book,The Thames near Kelmscott Manor,Sir Sydney Cockerell|Frederick H. Evans|Unknown|Aubrey Vincent Beardsley|Frederick Colin Tilney|Ernest Radford|Theodore Watts-Dunton,1896,Rivers|Landscapes
FALSE,675528,Photographs,Album; Artist's book,From the Meadows,Frederick H. Evans|Unknown|Aubrey Vincent Beardsley|Frederick Colin Tilney|Ernest Radford|Theodore Watts-Dunton|Sir Sydney Cockerell,1896,Roads|Landscapes
FALSE,675529,Photographs,Album; Artist's book,From the Fields,Frederick H. Evans|Unknown|Aubrey Vincent Beardsley|Frederick Colin Tilney|Ernest Radford|Theodore Watts-Dunton|Sir Sydney Cockerell,1896,Houses|Landscapes
FALSE,11600,American Decorative Arts,Painting,The Teton Range,Thomas Moran,1897,Landscapes|Mountains
FALSE,11771,American Decorative Arts,Painting,Banks of the Loing,William Lamb Picknell,1897,Rivers|Landscapes
FALSE,12062,American Decorative Arts,Watercolor,Clouds,John Singer Sargent,1897,Landscapes|Clouds
FALSE,12179,American Decorative Arts,Watercolor,Scotland,John Singer Sargent,1897,Landscapes|Mountains
FALSE,54619,Asian Art,Album leaf,,Kawanabe Kyōsai,1897,Landscapes|Trees
FALSE,54628,Asian Art,Album leaf,,Kawanabe Kyōsai,1897,Landscapes
FALSE,55872,Asian Art,Print,,Yōshū (Hashimoto) Chikanobu,1897,Birds|Men|Landscapes|Trees
FALSE,334187,Drawings and Prints,Print,Au Pied du Sinaï,Henri de Toulouse-Lautrec,1897,Sun|Mountains|Landscapes
FALSE,340260,Drawings and Prints,Drawing,Landscape with Trees near a Pond,Willem Roelofs,1897,Landscapes|Trees
FALSE,384597,Drawings and Prints,Drawing,Winter Landscape with Frozen River,Lodewijk Johannes Kleijn|Pieter Rudolph Kleyn,1897,Windmills|Rivers|Landscapes|Winter
FALSE,385108,Drawings and Prints,Drawing,Design for mural decoration surrounding a door: landscape with classical ruins,Jules-Edmond-Charles Lachaise|Eugène-Pierre Gourdet,1897,Murals|Ruins|Landscapes
FALSE,385109,Drawings and Prints,Drawing,Design for mural decoration surrounding a door:  landscape with classical ruins,Jules-Edmond-Charles Lachaise|Eugène-Pierre Gourdet,1897,Doors|Ruins|Landscapes
FALSE,385118,Drawings and Prints,Drawing,Elevation of a paneled interior decorated with painted landscapes and coves with cartouches and flowers,Jules-Edmond-Charles Lachaise|Eugène-Pierre Gourdet,1897,Landscapes
FALSE,437126,European Paintings,Painting,Île aux Orties near Vernon,Claude Monet,1897,Rivers|Landscapes
FALSE,440351,European Paintings,Painting,Landscape with a Castle on the River Etsch,Louis Gurlitt,1897,Castles|Rivers|Landscapes
FALSE,480999,Modern and Contemporary Art,Drawing,Sergievo,Konstantin Somov,1897,Landscapes|Trees
FALSE,768861,Drawings and Prints,Print,"Twilight (Skymning), from the portfolio of the Swedish Fine Art Print Society (Föreningen för Grafisk Konst)",Föreningen för Grafisk Konst|Alfred Bergström,1897,Landscapes|Boats
FALSE,10196,American Decorative Arts,Painting,September Evening,George H. Bogert,1898,Landscapes|Evening
FALSE,11978,American Decorative Arts,Painting,Landscape,Albert Pinkham Ryder,1898,Animals|Men|Landscapes
FALSE,36186,Asian Art,Handscroll,清  松年  山水  手卷|Landscape,Song Nian,1898,Mountains|Landscapes|Trees
FALSE,267690,Photographs,Photograph,Ein Sommertag,Heinrich Kühn,1898,Landscapes|Clouds
FALSE,360123,Drawings and Prints,Print,The Large Bathers (Les Baigneurs),Paul Cézanne,1898,Men|Male Nudes|Landscapes|Trees|Bathing
FALSE,459098,Robert Lehman Collection,Painting,View of Saint-Valéry-sur-Somme,Edgar Degas,1898,Towns|Landscapes
FALSE,11121,American Decorative Arts,Watercolor,"Flower Garden and Bungalow, Bermuda",Winslow Homer,1899,Landscapes|Gardens
FALSE,11752,American Decorative Arts,Drawing,Tours from the River,Joseph Pennell,1899,Buildings|Rivers|Landscapes|Trees
FALSE,11970,American Decorative Arts,Watercolor,Indian Braves,Charles M. Russell,1899,Bow and Arrow|Men|Horse Riding|Landscapes
FALSE,37915,Asian Art,Painting,,,1899,Men|Hunting|Horse Riding|Boars|Landscapes
FALSE,39616,Asian Art,Sculpture,清中期    青金石羅漢山子|Seated luohan with a servant,,1899,Men|Landscapes|Buddhism
FALSE,40960,Asian Art,Vase,,,1899,Houses|Landscapes|Trees|Vases
FALSE,41108,Asian Art,Snuff bottle with stopper,,,1899,Landscapes|Bottles
FALSE,41109,Asian Art,Snuff bottle with stopper,,,1899,Landscapes|Bottles
FALSE,41225,Asian Art,Snuff bottle,,,1899,Landscapes|Bottles
FALSE,41554,Asian Art,Snuff bottle,,,1899,Landscapes
FALSE,41571,Asian Art,Snuff bottle,,,1899,Landscapes|Bottles
FALSE,41922,Asian Art,Table screen,清 翡翠山水圖屏|Table screen with landscape scene,,1899,Buildings|Landscapes|Screens
FALSE,42005,Asian Art,Table screen,清 玉雕山水人物圖屏|Table screen with land of immortals,,1899,Human Figures|Landscapes|Trees|Screens
FALSE,42224,Asian Art,Vase,,,1899,Birds|Flowers|Landscapes|Trees|Vases
FALSE,43857,Asian Art,Brush holder,清 玉雕山林隱逸圖筆筒|Brush Holder with Recluses,,1899,Scrolls|Men|Landscapes
FALSE,44865,Asian Art,Screens,,Ike Taiga,1899,Mountains|Landscapes|Trees
FALSE,45367,Asian Art,Writing box,,,1899,Landscapes|Writing Implements
FALSE,45648,Asian Art,Hanging scroll,,Yōgetsu,1899,Moon|Landscapes
FALSE,46132,Asian Art,Covered jar,,,1899,Flowers|Landscapes|Jars
FALSE,46302,Asian Art,Dish,,,1899,Landscapes|Dishes
FALSE,47310,Asian Art,Plate,,,1899,Landscapes|Dishes
FALSE,51087,Asian Art,Print,,Utagawa Kunisada,1899,Human Figures|Horses|Landscapes|Trees|Rain
FALSE,51290,Asian Art,Panel,,,1899,Bridges|Hills|Landscapes|Trees|Boats
FALSE,51485,Asian Art,Hanging scrolls,清 緙絲山水人物圖|Mythical landscape with immortals,Unidentified Artist,1899,Men|Women|Landscapes
FALSE,51520,Asian Art,Tapestry,清 緙絲乾隆南巡宮苑圖|Scenic Sites in the Qianlong Emperor’s Southern Inspection Tour,,1899,Landscapes
FALSE,51776,Asian Art,Album,,Bi Chang,1899,Rivers|Landscapes|Boats
FALSE,52804,Asian Art,Bottle,,,1899,Landscapes|Bottles
FALSE,53458,Asian Art,Folding fan mounted,「残雨半村」図|“Lingering Rain over Half the Village”,Uragami Gyokudō,1899,Mountains|Landscapes
FALSE,53463,Asian Art,Four hanging scrolls,四季山水図|Landscapes of the Four Seasons,Yamamoto Baiitsu,1899,Mountains|Landscapes|Trees
FALSE,53465,Asian Art,Hanging scroll,,Kameda Bōsai,1899,Waterfalls|Mountains|Landscapes|Trees
FALSE,53466,Asian Art,Hanging scroll,,Tani Bunchō,1899,Waterfalls|Mountains|Landscapes|Trees
FALSE,53594,Asian Art,Album,,Unidentified Artist,1899,Mountains|Landscapes|Calligraphy
FALSE,53814,Asian Art,Printer's woodblock,,Utagawa Toyokuni I,1899,Women|Landscapes
FALSE,54130,Asian Art,Print,,Totoya Hokkei,1899,Turtles|Landscapes|Men|Women
FALSE,54518,Asian Art,Print,,Ryūryūkyo Shinsai,1899,Landscapes
FALSE,54705,Asian Art,Print,,Kubo Shunman,1899,Horses|Hills|Landscapes|Snow
FALSE,54905,Asian Art,Print,,Ryūryūkyo Shinsai,1899,Landscapes|Trees
FALSE,54908,Asian Art,Print,,Kubo Shunman,1899,Cranes|Seas|Landscapes
FALSE,55299,Asian Art,Hanging scroll,,Shiokawa Bunrin,1899,Moon|Mountains|Landscapes|Trees
FALSE,55634,Asian Art,Print,,Keisai Eisen,1899,Landscapes|Castles|Bridges|Hills
FALSE,55635,Asian Art,Print,名所江戸百景　目黒太鼓橋夕ひの岡|Ochanomizu,Utagawa Hiroshige,1899,Landscapes|Streams|Human Figures|Bridges|Snow
FALSE,55713,Asian Art,Print,,Utagawa Hiroshige II,1899,Human Figures|Landscapes|Trees
FALSE,57110,Asian Art,Printer's woodblock,,Utagawa Hiroshige,1899,Landscapes|Trees
FALSE,57325,Asian Art,Folding screen,,Andō Baiho,1899,Houses|Villages|Landscapes|Trees|Boats
FALSE,57594,Asian Art,Box,若松南天蒔絵色紙箱|Box for Square Calligraphy Paper (shikishi-bako) with an Auspicious Landscape of Young Pines and Nandina Shrubs,,1899,Landscapes|Writing Implements
FALSE,57694,Asian Art,Incense box,,,1899,Hills|Landscapes|Trees
FALSE,57956,Asian Art,Box,,,1899,Landscapes|Trees
FALSE,58138,Asian Art,Writing box,,,1899,Birds|Landscapes|Trees|Writing Implements
FALSE,58246,Asian Art,Kakemono,,,1899,Mountains|Landscapes|Clouds
FALSE,58376,Asian Art,Inrō,,,1899,Landscapes|Boats
FALSE,58377,Asian Art,Inrō,,,1899,Men|Landscapes|Trees
FALSE,58383,Asian Art,Inrō,,,1899,Buildings|Mountains|Landscapes|Waves|Boats
FALSE,58386,Asian Art,Inrō,,,1899,Buildings|Landscapes
FALSE,58390,Asian Art,Inrō,,,1899,Deer|Hills|Landscapes
FALSE,58393,Asian Art,Inrō,,,1899,Buildings|Rivers|Landscapes|Trees
FALSE,58555,Asian Art,Inrō,,,1899,Waterfalls|Landscapes
FALSE,58630,Asian Art,Inrō,,,1899,Landscapes|Trees
FALSE,58648,Asian Art,Inrō,,,1899,Bridges|Landscapes
FALSE,58725,Asian Art,Inrō,,,1899,Landscapes
FALSE,58776,Asian Art,Inrō,,,1899,Buildings|Mountains|Landscapes
FALSE,58864,Asian Art,Inrō,東海道五十三次蒔絵印籠|Inrō with the “Fifty-three Stations of the Tōkaidō”,,1899,Mountains|Landscapes
FALSE,58917,Asian Art,Inrō,,,1899,Bridges|Landscapes
FALSE,60715,Asian Art,Cricket cage,,,1899,Landscapes
FALSE,60928,Asian Art,Screens,清    剔紅西廂故事圖插屏一對|Pair of screens with scenes from Romance of the West Chamber,,1899,Men|Women|Butterflies|Landscapes
FALSE,64083,Asian Art,Screen,清晚期    彩石鑲嵌山水人物圖屏風|Folding screen with figures in a landscape,,1899,Landscapes|Ships
FALSE,64390,Asian Art,Stencil,,,1899,Landscapes
FALSE,65656,Asian Art,Sleeve Band,,,1899,Human Figures|Animals|Landscapes
FALSE,65848,Asian Art,Piece,,,1899,Landscapes
FALSE,66604,Asian Art,Piece,,,1899,Landscapes|Plants
FALSE,67172,Asian Art,Piece,,,1899,Landscapes
FALSE,67571,Asian Art,Piece,,,1899,Landscapes
FALSE,67719,Asian Art,Piece,,,1899,Landscapes|Boats
FALSE,68286,Asian Art,"Picture, Tapestry",,,1899,Boats|Landscapes|Pavilions
FALSE,68288,Asian Art,"Picture, Tapestry",清 緙絲乾隆南巡宮苑圖|Scenic Sites in the Qianlong Emperor’s Southern Inspection Tour,,1899,Landscapes
FALSE,68289,Asian Art,"Picture, Tapestry",,,1899,Landscapes
FALSE,68614,Asian Art,Sleeve Band,,,1899,Human Figures|Cranes|Horses|Landscapes
FALSE,68615,Asian Art,Sleeve Band,,,1899,Human Figures|Cranes|Horses|Landscapes
FALSE,68678,Asian Art,Sleeve Band,,,1899,Women|Landscapes
FALSE,68719,Asian Art,Sleeve Band,,,1899,Boats|Landscapes
FALSE,68722,Asian Art,Sleeve Band,,,1899,Landscapes
FALSE,68748,Asian Art,Sleeve Band,,,1899,Landscapes|Pavilions
FALSE,70167,Asian Art,Stencil,,,1899,Human Figures|Bridges|Landscapes
FALSE,185927,European Sculpture and Decorative Arts,Teabowl,Teabowl,,1899,Landscapes|Trees|Bowls
FALSE,188380,European Sculpture and Decorative Arts,Plate,Plate,Phillips and Co.,1899,Chinoiserie|Human Figures|Landscapes
FALSE,191318,European Sculpture and Decorative Arts,Plate,Plate,Enoch Wood & Sons,1899,Buildings|Flowers|Landscapes
FALSE,191320,European Sculpture and Decorative Arts,Plate,Plate,J. & G. Meakin,1899,Houses|Landscapes|Trees|Boats
FALSE,191669,European Sculpture and Decorative Arts,Plate,Plate (part of a service),Crown Derby,1899,Landscapes
